{
  "schemaVersion": "health-v1",
  "version": "0.1.7",
  "platform": "linux",
  "daemon": {
    "running": true,
    "ready": true,
    "endpoint": "/run/user/1000/axon-v1.sock",
    "processId": 2317
  },
  "registration": {
    "registered": true,
    "mechanism": "systemdUser",
    "path": "/opt/axon/0.1.7/axon-linux"
  },
  "session": {
    "interactive": true,
    "graphical": true,
    "detail": "wayland"
  },
  "permissions": [
    {
      "name": "accessibilityBus",
      "granted": true
    }
  ],
  "capabilities": [
    {
      "capability": "enumerate",
      "usable": true
    },
    {
      "capability": "capture",
      "usable": true
    },
    {
      "capability": "retainedHandles",
      "usable": true
    },
    {
      "capability": "observeChanges",
      "usable": false,
      "reason": "not-implemented",
      "restriction": "AT-SPI event observation is not implemented"
    },
    {
      "capability": "invoke",
      "usable": true
    },
    {
      "capability": "readValue",
      "usable": true
    },
    {
      "capability": "setValue",
      "usable": true
    },
    {
      "capability": "focus",
      "usable": true
    },
    {
      "capability": "scroll",
      "usable": false,
      "reason": "not-implemented",
      "restriction": "AT-SPI has no portable delta-scroll operation"
    },
    {
      "capability": "pointerInput",
      "usable": false,
      "reason": "wayland-restricted",
      "restriction": "this is a Wayland session: the compositor does not permit unrestricted synthetic input, and X11 cannot read or set the Wayland foreground even where XWayland is running alongside"
    },
    {
      "capability": "keyboardInput",
      "usable": false,
      "reason": "wayland-restricted",
      "restriction": "this is a Wayland session: the compositor does not permit unrestricted synthetic input, and X11 cannot read or set the Wayland foreground even where XWayland is running alongside"
    },
    {
      "capability": "screenshot",
      "usable": false,
      "reason": "portal-authorization-required",
      "restriction": "a desktop portal authorization flow is required"
    },
    {
      "capability": "hitTest",
      "usable": false,
      "reason": "wayland-restricted",
      "restriction": "this is a Wayland session: the compositor does not permit unrestricted synthetic input, and X11 cannot read or set the Wayland foreground even where XWayland is running alongside"
    },
    {
      "capability": "serializeHistory",
      "usable": true
    },
    {
      "capability": "observeGlobalInput",
      "usable": false,
      "reason": "wayland-restricted",
      "restriction": "this is a Wayland session: the compositor delivers input only to the surface it is aimed at, and there is no listen-only global input protocol to ask it for the rest -- by design rather than by omission"
    }
  ]
}
